{
  "registry_version": "1.1.1",
  "schema_version": "1.0",
  "authority": "Master Indicator Registry v1.0",
  "seed_status": "authoritative_seeded",
  "indicators": [
    {
      "indicator_id":"IND-MFG-GVA-GROWTH-001","name":"Real manufacturing GVA growth","definition":"Annual percentage change in real Gross Value Added of manufacturing at constant prices in the current National Accounts series.","unit":"%","frequency":"ANNUAL","directionality":"POSITIVE","indicator_type":"GROWTH","measurement_type":"RATE","sector":"MFG","sub_sector":null,"domain":"GVA","geography":["INDIA"],"baseline":{"preferred_reference":"2013-14","availability":"subject to current NAS back-series"},"benchmark":null,"target":null,"calculation_method":"Use the source-defined annual real manufacturing GVA growth rate. Do not recompute from mixed-vintage levels without recording the vintage and base series.","methodology_version":"IND-MFG-REG-1.0","update_class":"U5","health_status":"Watch","source_mapping":[{"source_id":"SRC-MOSPI-NAS","dataset_id":"DS-MOSPI-NAS-001","priority":1,"relationship":"primary","effective_date":"2026-09-07","end_date":null}],"version_history":[{"version":"1.0","definition":"Annual percentage change in real manufacturing GVA using the current National Accounts series.","numerator":"current-period real manufacturing GVA minus prior-period real manufacturing GVA","denominator":"prior-period real manufacturing GVA","methodology":"MoSPI National Accounts methodology, current base 2022-23","base_year":"2022-23","effective_date":"2026-09-07","source_id":"SRC-MOSPI-NAS","comparability_status":"Use source-defined current-series back-series and preserve revisions."}]
    },
    {
      "indicator_id":"IND-MFG-GVA-SHARE-001","name":"Manufacturing share of GVA","definition":"Manufacturing GVA as a percentage of total GVA for the same reference period and price basis.","unit":"% of total GVA","frequency":"ANNUAL","directionality":"POSITIVE","indicator_type":"SHARE","measurement_type":"RATIO","sector":"MFG","sub_sector":null,"domain":"GVA","geography":["INDIA"],"baseline":{"preferred_reference":"2013-14","availability":"subject to current NAS series"},"benchmark":null,"target":null,"calculation_method":"Manufacturing GVA / total GVA * 100, using the same NAS vintage, price basis and reference period for numerator and denominator.","methodology_version":"IND-MFG-REG-1.0","update_class":"U5","health_status":"Watch","source_mapping":[{"source_id":"SRC-MOSPI-NAS","dataset_id":"DS-MOSPI-NAS-001","priority":1,"relationship":"primary","effective_date":"2026-09-07","end_date":null}],"version_history":[{"version":"1.0","definition":"Manufacturing GVA divided by total GVA for the same period and price basis.","numerator":"manufacturing GVA","denominator":"total GVA","methodology":"Derived from MoSPI National Accounts series.","base_year":"2022-23 for constant-price variants","effective_date":"2026-09-07","source_id":"SRC-MOSPI-NAS","comparability_status":"Derived metric; preserve NAS revisions and price basis."}]
    },
    {
      "indicator_id":"IND-MFG-IIP-001","name":"Manufacturing Index of Industrial Production","definition":"Monthly manufacturing sector index measuring changes in the volume of production relative to the IIP base period.","unit":"index, 2022-23=100","frequency":"MONTHLY","directionality":"POSITIVE","indicator_type":"INDEX","measurement_type":"LEVEL","sector":"MFG","sub_sector":null,"domain":"OUTPUT","geography":["INDIA"],"baseline":{"preferred_reference":"2022-23=100 base","availability":"current IIP series"},"benchmark":null,"target":null,"calculation_method":"Use the MoSPI published manufacturing sector IIP index. Preserve quick estimate, revised and final vintages separately.","methodology_version":"IND-MFG-REG-1.0","update_class":"U3","health_status":"Watch","source_mapping":[{"source_id":"SRC-MOSPI-IIP","dataset_id":"DS-MOSPI-IIP-001","priority":1,"relationship":"primary","effective_date":"2026-09-07","end_date":null}],"version_history":[{"version":"1.0","definition":"Manufacturing sector IIP under the new 2022-23 base series.","numerator":null,"denominator":null,"methodology":"MoSPI IIP new series, base 2022-23, NIC 2008 classification.","base_year":"2022-23","effective_date":"2026-09-07","source_id":"SRC-MOSPI-IIP","comparability_status":"Do not silently splice with the superseded 2011-12 series. Latest observation is provisional and prior observations are subject to revision."}]
    },
    {
      "indicator_id":"IND-MFG-ASI-GVA-001","name":"Registered manufacturing GVA","definition":"Gross Value Added reported for factories covered by the Annual Survey of Industries, at the published national or State aggregation level.","unit":"₹ lakh, source-defined","frequency":"ANNUAL","directionality":"POSITIVE","indicator_type":"LEVEL","measurement_type":"CURRENCY","sector":"MFG","sub_sector":null,"domain":"GVA","geography":["INDIA","STATE"],"baseline":{"preferred_reference":"2013-14","availability":"ASI historical releases subject to series coverage"},"benchmark":null,"target":null,"calculation_method":"Use published ASI GVA aggregate for the selected geography and reference year. Do not treat ASI GVA as total manufacturing GVA because ASI covers registered organised manufacturing.","methodology_version":"IND-MFG-REG-1.0","update_class":"U5","health_status":"Missing","source_mapping":[{"source_id":"SRC-MOSPI-ASI","dataset_id":"DS-MOSPI-ASI-001","priority":1,"relationship":"primary","effective_date":"2026-09-07","end_date":null}],"version_history":[{"version":"1.0","definition":"Published ASI gross value added for registered organised manufacturing factories.","numerator":null,"denominator":null,"methodology":"MoSPI Annual Survey of Industries methodology.","base_year":null,"effective_date":"2026-09-07","source_id":"SRC-MOSPI-ASI","comparability_status":"Coverage is registered organised manufacturing; retain ASI methodology and coverage notes."}]
    },
    {
      "indicator_id":"IND-MFG-ASI-EMP-001","name":"Registered manufacturing persons engaged","definition":"Total persons engaged in factories covered by the Annual Survey of Industries, at the published national or State aggregation level.","unit":"persons","frequency":"ANNUAL","directionality":"POSITIVE","indicator_type":"COUNT","measurement_type":"COUNT","sector":"MFG","sub_sector":null,"domain":"EMPLOYMENT","geography":["INDIA","STATE"],"baseline":{"preferred_reference":"2013-14","availability":"ASI historical releases subject to series coverage"},"benchmark":null,"target":null,"calculation_method":"Use published ASI persons-engaged aggregate for the selected geography and reference year.","methodology_version":"IND-MFG-REG-1.0","update_class":"U5","health_status":"Missing","source_mapping":[{"source_id":"SRC-MOSPI-ASI","dataset_id":"DS-MOSPI-ASI-001","priority":1,"relationship":"primary","effective_date":"2026-09-07","end_date":null}],"version_history":[{"version":"1.0","definition":"Total persons engaged in ASI-covered factories.","numerator":null,"denominator":null,"methodology":"MoSPI Annual Survey of Industries methodology and published summary tables.","base_year":null,"effective_date":"2026-09-07","source_id":"SRC-MOSPI-ASI","comparability_status":"Registered organised manufacturing only; not a measure of total manufacturing employment."}]
    },
    {
      "indicator_id":"IND-MFG-PLFS-SHARE-001","name":"Manufacturing share of workers","definition":"Share of workers classified in manufacturing industry divisions 10-33 under NIC 2008 among workers measured by the specified PLFS activity-status concept.","unit":"% of workers","frequency":"ANNUAL","directionality":"POSITIVE","indicator_type":"SHARE","measurement_type":"RATIO","sector":"MFG","sub_sector":null,"domain":"EMPLOYMENT","geography":["INDIA","STATE"],"baseline":{"preferred_reference":"2017-18","availability":"PLFS annual reports"},"benchmark":null,"target":null,"calculation_method":"Use PLFS published industry-of-work estimates for NIC 2008 manufacturing divisions 10-33. Preserve the activity-status concept and survey design for each vintage.","methodology_version":"IND-MFG-REG-1.0","update_class":"U5","health_status":"Missing","source_mapping":[{"source_id":"SRC-MOSPI-PLFS","dataset_id":"DS-MOSPI-PLFS-001","priority":1,"relationship":"primary","effective_date":"2026-09-07","end_date":null}],"version_history":[{"version":"1.0","definition":"PLFS worker share associated with manufacturing industry divisions 10-33 under the specified PLFS concept.","numerator":"workers in manufacturing divisions 10-33 under the specified PLFS concept","denominator":"workers in the same PLFS universe","methodology":"PLFS annual survey concepts, NIC 2008 industry classification for the historical series.","base_year":null,"effective_date":"2026-09-07","source_id":"SRC-MOSPI-PLFS","comparability_status":"Review the 2025 sampling-design change before comparing post-2025 estimates with earlier annual estimates."}]
    },
    {